{
  "$schema": "../manifest.schema.json",
  "family": "msi_calculator",
  "name": "MSI Calculator",
  "version": "2.0.0",
  "task": "spectral_index",
  "domain": "indices",
  "architecture": "spectral_formula",
  "license": "MPL-2.0",
  "status": "reference",
  "trained": false,
  "description": "Moisture Stress Index, SWIR1 / NIR (Rock et al., 1986).",
  "inputs": {
    "bands": [
      "nir",
      "swir1"
    ],
    "dates": 1,
    "channels": [
      "nir",
      "swir1"
    ]
  },
  "outputs": {
    "names": [
      "msi"
    ],
    "units": [],
    "range": null,
    "scale": 1,
    "formula": "msi",
    "layout": "Tensor (N, 1, H, W) with the index value; NaN where undefined."
  },
  "training_labels": "None, the formula needs no training.",
  "data_sources": [
    "Surface reflectance from Sentinel-2",
    "Landsat or similar sensors"
  ],
  "variants": {
    "tiny": {
      "model_id": "msi_calculator_tiny",
      "tile_size": 256,
      "base_channels": 16,
      "depth": 3,
      "num_parameters": 0,
      "weights_digest": "e3b0c44298fc1c149afbf4c8996fb92427ae41e4649b934ca495991b7852b855"
    },
    "base": {
      "model_id": "msi_calculator_base",
      "tile_size": 256,
      "base_channels": 32,
      "depth": 4,
      "num_parameters": 0,
      "weights_digest": "e3b0c44298fc1c149afbf4c8996fb92427ae41e4649b934ca495991b7852b855"
    },
    "large": {
      "model_id": "msi_calculator_large",
      "tile_size": 512,
      "base_channels": 48,
      "depth": 4,
      "num_parameters": 0,
      "weights_digest": "e3b0c44298fc1c149afbf4c8996fb92427ae41e4649b934ca495991b7852b855"
    },
    "mega": {
      "model_id": "msi_calculator_mega",
      "tile_size": 512,
      "base_channels": 64,
      "depth": 5,
      "num_parameters": 0,
      "weights_digest": "e3b0c44298fc1c149afbf4c8996fb92427ae41e4649b934ca495991b7852b855"
    }
  }
}
