{
  "$schema": "../manifest.schema.json",
  "family": "sar_ship_detector",
  "name": "SAR Ship Detector",
  "version": "2.0.0",
  "task": "detection",
  "domain": "sar",
  "architecture": "centernet",
  "license": "MPL-2.0",
  "status": "starter",
  "trained": false,
  "description": "Detects ships in synthetic aperture radar backscatter, independent of cloud cover and daylight.",
  "inputs": {
    "bands": [
      "VV",
      "VH"
    ],
    "dates": 1,
    "channels": [
      "VV",
      "VH"
    ]
  },
  "outputs": {
    "names": [
      "ship"
    ],
    "units": [],
    "range": null,
    "scale": 1,
    "formula": null,
    "layout": "Tensor (N, K + 4, H/4, W/4): K class heatmap logits, box width and height in output-stride pixels, and the x and y centre offsets."
  },
  "training_labels": "Bounding boxes of ships in SAR images.",
  "data_sources": [
    "Sentinel-1 GRD (sigma0 in dB)",
    "other C- or X-band SAR"
  ],
  "variants": {
    "tiny": {
      "model_id": "sar_ship_detector_tiny",
      "tile_size": 256,
      "base_channels": 16,
      "depth": 3,
      "num_parameters": 730437,
      "weights_digest": "ab387c54219cc513220304d291959350330a3a5cff661852b8841ee8b310fa24"
    },
    "base": {
      "model_id": "sar_ship_detector_base",
      "tile_size": 256,
      "base_channels": 32,
      "depth": 4,
      "num_parameters": 7048837,
      "weights_digest": "5a15158cf77437fa0649d9cafda9fe8542015aef1ddb22a49db20735aefbbd98"
    },
    "large": {
      "model_id": "sar_ship_detector_large",
      "tile_size": 512,
      "base_channels": 48,
      "depth": 4,
      "num_parameters": 22037765,
      "weights_digest": "425d657f352865e14bcb3fa6e1fc0a2a8e3bff1ca433a8e12f764d33afc0306c"
    },
    "mega": {
      "model_id": "sar_ship_detector_mega",
      "tile_size": 512,
      "base_channels": 64,
      "depth": 5,
      "num_parameters": 60412933,
      "weights_digest": "dc0bfbfdf1665667bb42b32c308b5e63f1791780c1c24a34a84fef173026ed3d"
    }
  }
}
