{
  "$schema": "../manifest.schema.json",
  "family": "spatial_relationship",
  "name": "Proximity Estimator",
  "version": "2.0.0",
  "task": "dense_regression",
  "domain": "analysis",
  "architecture": "unet_regression",
  "license": "MPL-2.0",
  "status": "starter",
  "trained": false,
  "description": "Estimates the distance to the nearest mapped feature of interest.",
  "inputs": {
    "bands": [
      "blue",
      "green",
      "red",
      "nir"
    ],
    "dates": 1,
    "channels": [
      "blue",
      "green",
      "red",
      "nir"
    ]
  },
  "outputs": {
    "names": [
      "distance"
    ],
    "units": [
      "m"
    ],
    "range": null,
    "scale": 1,
    "formula": null,
    "layout": "Tensor (N, K, H, W) of target values in the listed units."
  },
  "training_labels": "Distance rasters derived from reference vector data.",
  "data_sources": [
    "Sentinel-2 10 m bands",
    "PlanetScope"
  ],
  "variants": {
    "tiny": {
      "model_id": "spatial_relationship_tiny",
      "tile_size": 256,
      "base_channels": 16,
      "depth": 3,
      "num_parameters": 733073,
      "weights_digest": "34a626d26f59a6f1cc0a0bf6203357199c5c66f039915f6cd62228620debe6d2"
    },
    "base": {
      "model_id": "spatial_relationship_base",
      "tile_size": 256,
      "base_channels": 32,
      "depth": 4,
      "num_parameters": 7058721,
      "weights_digest": "5b5080873cae7ce4feabf12a7df397d2863156b4c8a6e28a798133dc4209db73"
    },
    "large": {
      "model_id": "spatial_relationship_large",
      "tile_size": 512,
      "base_channels": 48,
      "depth": 4,
      "num_parameters": 22059505,
      "weights_digest": "0368cb8a6a3c087ad3076d11e12b9837219ec58f57a2b585fdb020426fa73731"
    },
    "mega": {
      "model_id": "spatial_relationship_mega",
      "tile_size": 512,
      "base_channels": 64,
      "depth": 5,
      "num_parameters": 60451137,
      "weights_digest": "4837ca2f8e275f88bdb21735b1c437db737bc388662d74852d40a20a493319d6"
    }
  }
}
