{
  "$schema": "../manifest.schema.json",
  "family": "digitization_2d",
  "name": "2D Digitisation",
  "version": "2.0.0",
  "task": "segmentation",
  "domain": "imaging",
  "architecture": "unet",
  "license": "MPL-2.0",
  "status": "starter",
  "trained": false,
  "description": "Segments buildings, roads, water and vegetation for map digitisation.",
  "inputs": {
    "bands": [
      "red",
      "green",
      "blue"
    ],
    "dates": 1,
    "channels": [
      "red",
      "green",
      "blue"
    ]
  },
  "outputs": {
    "names": [
      "background",
      "building",
      "road",
      "water",
      "vegetation"
    ],
    "units": [],
    "range": null,
    "scale": 1,
    "formula": null,
    "layout": "Tensor (N, K, H, W) of class logits; apply softmax over K."
  },
  "training_labels": "Masks of the four map feature classes.",
  "data_sources": [
    "Aerial or satellite RGB imagery"
  ],
  "variants": {
    "tiny": {
      "model_id": "digitization_2d_tiny",
      "tile_size": 256,
      "base_channels": 16,
      "depth": 3,
      "num_parameters": 732997,
      "weights_digest": "4558c9f31f4e03b240b3ae135be997c94bd846fb0cb44dec665dd61f3c9232b9"
    },
    "base": {
      "model_id": "digitization_2d_base",
      "tile_size": 256,
      "base_channels": 32,
      "depth": 4,
      "num_parameters": 7058565,
      "weights_digest": "03d0537b05aacc0a646f7d6e3b6bab543bba59d3530a4165e8cf52dc46859113"
    },
    "large": {
      "model_id": "digitization_2d_large",
      "tile_size": 512,
      "base_channels": 48,
      "depth": 4,
      "num_parameters": 22059269,
      "weights_digest": "baf627394fc363b2e54004aca7555fe0f47b97ed633befd835bf525bff53c676"
    },
    "mega": {
      "model_id": "digitization_2d_mega",
      "tile_size": 512,
      "base_channels": 64,
      "depth": 5,
      "num_parameters": 60450821,
      "weights_digest": "629e71d90579798bc68f39c6a09e0c87451f91410d0a765aff8674ba854ef994"
    }
  }
}
