{
  "$schema": "../manifest.schema.json",
  "family": "wind_site_selector",
  "name": "Wind Site Selector",
  "version": "2.0.0",
  "task": "dense_regression",
  "domain": "energy",
  "architecture": "unet_regression",
  "license": "MPL-2.0",
  "status": "starter",
  "trained": false,
  "description": "Scores suitability for wind turbines.",
  "inputs": {
    "bands": [
      "B02",
      "B03",
      "B04",
      "B05",
      "B06",
      "B07",
      "B08",
      "B8A",
      "B11",
      "B12",
      "elevation",
      "slope"
    ],
    "dates": 1,
    "channels": [
      "B02",
      "B03",
      "B04",
      "B05",
      "B06",
      "B07",
      "B08",
      "B8A",
      "B11",
      "B12",
      "elevation",
      "slope"
    ]
  },
  "outputs": {
    "names": [
      "suitability"
    ],
    "units": [
      "1"
    ],
    "range": [
      0.0,
      1.0
    ],
    "scale": 1,
    "formula": null,
    "layout": "Tensor (N, K, H, W) of target values in the listed units."
  },
  "training_labels": "Suitability scores or existing turbine locations.",
  "data_sources": [
    "Sentinel-2 L2A",
    "Copernicus DEM"
  ],
  "variants": {
    "tiny": {
      "model_id": "wind_site_selector_tiny",
      "tile_size": 256,
      "base_channels": 16,
      "depth": 3,
      "num_parameters": 734225,
      "weights_digest": "68946245417cd1b902ca3dfef41ac647fbc1b7e8676c8e67cd4de4ee135c7c97"
    },
    "base": {
      "model_id": "wind_site_selector_base",
      "tile_size": 256,
      "base_channels": 32,
      "depth": 4,
      "num_parameters": 7061025,
      "weights_digest": "66a42796252514715a44dd7631f26b62f8869057c71048fec81383d40c227e0e"
    },
    "large": {
      "model_id": "wind_site_selector_large",
      "tile_size": 512,
      "base_channels": 48,
      "depth": 4,
      "num_parameters": 22062961,
      "weights_digest": "64374c57f881a916515e285fe878bf5496df27c589bd7ece0a0a5fb3ae6b5ca2"
    },
    "mega": {
      "model_id": "wind_site_selector_mega",
      "tile_size": 512,
      "base_channels": 64,
      "depth": 5,
      "num_parameters": 60455745,
      "weights_digest": "75b025295d1e4b2aeb4c2f07823eaaa5427caf42e9e95c6e6930c443a87c5f0c"
    }
  }
}
