{
  "$schema": "../manifest.schema.json",
  "family": "business_valuation",
  "name": "Economic Activity Estimator",
  "version": "2.0.0",
  "task": "scene_regression",
  "domain": "analysis",
  "architecture": "encoder_regressor",
  "license": "MPL-2.0",
  "status": "starter",
  "trained": false,
  "description": "Estimates an economic activity index of an area from imagery.",
  "inputs": {
    "bands": [
      "blue",
      "green",
      "red",
      "nir"
    ],
    "dates": 1,
    "channels": [
      "blue",
      "green",
      "red",
      "nir"
    ]
  },
  "outputs": {
    "names": [
      "activity_index"
    ],
    "units": [
      "1"
    ],
    "range": null,
    "scale": 1,
    "formula": null,
    "layout": "Tensor (N, K) with one value per target and chip."
  },
  "training_labels": "Economic indicators aggregated to chips.",
  "data_sources": [
    "Sentinel-2 10 m bands",
    "night lights composites"
  ],
  "variants": {
    "tiny": {
      "model_id": "business_valuation_tiny",
      "tile_size": 256,
      "base_channels": 16,
      "depth": 3,
      "num_parameters": 494625,
      "weights_digest": "7ce1c3ef9d13c2bb12a19b28b23ee78ba74141ed6e6b912cc1c1fb2f24c32844"
    },
    "base": {
      "model_id": "business_valuation_base",
      "tile_size": 256,
      "base_channels": 32,
      "depth": 4,
      "num_parameters": 3745345,
      "weights_digest": "50cbc4e2ab9a289f38b8825a8e8dc739ab1adb21e96cac5c895d68eed0c1cad5"
    },
    "large": {
      "model_id": "business_valuation_large",
      "tile_size": 512,
      "base_channels": 48,
      "depth": 4,
      "num_parameters": 14606497,
      "weights_digest": "8d7330be36baa260b339c129b6d8aadac2d1659cca1e2fcbddb3d5bdccf015b1"
    },
    "mega": {
      "model_id": "business_valuation_mega",
      "tile_size": 512,
      "base_channels": 64,
      "depth": 5,
      "num_parameters": 37762945,
      "weights_digest": "d1d06d6e0343c5098a13362426b9bdb703be85c3789dd6ff9b2495f4854eaca1"
    }
  }
}
