{
  "$schema": "../manifest.schema.json",
  "family": "water_quality_assessor",
  "name": "Water Quality Assessor",
  "version": "2.0.0",
  "task": "dense_regression",
  "domain": "water",
  "architecture": "unet_regression",
  "license": "MPL-2.0",
  "status": "starter",
  "trained": false,
  "description": "Estimates chlorophyll-a concentration and turbidity in water bodies.",
  "inputs": {
    "bands": [
      "B02",
      "B03",
      "B04",
      "B05",
      "B06",
      "B07",
      "B08",
      "B8A",
      "B11",
      "B12"
    ],
    "dates": 1,
    "channels": [
      "B02",
      "B03",
      "B04",
      "B05",
      "B06",
      "B07",
      "B08",
      "B8A",
      "B11",
      "B12"
    ]
  },
  "outputs": {
    "names": [
      "chlorophyll_a",
      "turbidity"
    ],
    "units": [
      "mg m-3",
      "FNU"
    ],
    "range": null,
    "scale": 1,
    "formula": null,
    "layout": "Tensor (N, K, H, W) of target values in the listed units."
  },
  "training_labels": "In situ water quality samples.",
  "data_sources": [
    "Sentinel-2 L2A"
  ],
  "variants": {
    "tiny": {
      "model_id": "water_quality_assessor_tiny",
      "tile_size": 256,
      "base_channels": 16,
      "depth": 3,
      "num_parameters": 733954,
      "weights_digest": "28d5cc931ec67edfd98973083a9c17e39fcd7c0a6892ecf0c2efea65ca6b9a29"
    },
    "base": {
      "model_id": "water_quality_assessor_base",
      "tile_size": 256,
      "base_channels": 32,
      "depth": 4,
      "num_parameters": 7060482,
      "weights_digest": "556f7848d6629f852930a0a53bb363d812f2298dcad117b72e0bc5d7ccc5eae4"
    },
    "large": {
      "model_id": "water_quality_assessor_large",
      "tile_size": 512,
      "base_channels": 48,
      "depth": 4,
      "num_parameters": 22062146,
      "weights_digest": "d27c1dcc7022093a334e7a677b8f8aaa008d77aa4179667b0579a959b1ad3a96"
    },
    "mega": {
      "model_id": "water_quality_assessor_mega",
      "tile_size": 512,
      "base_channels": 64,
      "depth": 5,
      "num_parameters": 60454658,
      "weights_digest": "9cc5040098f1714e5ad135805027d6dfb4b6b1dfb18b91d2ef0d9a15c07e9fdd"
    }
  }
}
