{
  "$schema": "../manifest.schema.json",
  "family": "flood_risk_assessor",
  "name": "Flood Depth Estimator",
  "version": "2.0.0",
  "task": "dense_regression",
  "domain": "water",
  "architecture": "unet_regression",
  "license": "MPL-2.0",
  "status": "starter",
  "trained": false,
  "description": "Estimates flood water depth.",
  "inputs": {
    "bands": [
      "B02",
      "B03",
      "B04",
      "B05",
      "B06",
      "B07",
      "B08",
      "B8A",
      "B11",
      "B12",
      "elevation",
      "slope"
    ],
    "dates": 1,
    "channels": [
      "B02",
      "B03",
      "B04",
      "B05",
      "B06",
      "B07",
      "B08",
      "B8A",
      "B11",
      "B12",
      "elevation",
      "slope"
    ]
  },
  "outputs": {
    "names": [
      "water_depth"
    ],
    "units": [
      "m"
    ],
    "range": null,
    "scale": 1,
    "formula": null,
    "layout": "Tensor (N, K, H, W) of target values in the listed units."
  },
  "training_labels": "Flood depth rasters from hydraulic models or surveys.",
  "data_sources": [
    "Sentinel-2 L2A",
    "Copernicus DEM"
  ],
  "variants": {
    "tiny": {
      "model_id": "flood_risk_assessor_tiny",
      "tile_size": 256,
      "base_channels": 16,
      "depth": 3,
      "num_parameters": 734225,
      "weights_digest": "a2fc58c46dfdedab73999fc026c4d4c629fb5273bde152418b8199da0e19f24c"
    },
    "base": {
      "model_id": "flood_risk_assessor_base",
      "tile_size": 256,
      "base_channels": 32,
      "depth": 4,
      "num_parameters": 7061025,
      "weights_digest": "6dc538b46911625c8bef8358aa460501bedc5d622825b33492ccc3cea9828d9b"
    },
    "large": {
      "model_id": "flood_risk_assessor_large",
      "tile_size": 512,
      "base_channels": 48,
      "depth": 4,
      "num_parameters": 22062961,
      "weights_digest": "fd7a706be8d0cd351e54c6100793a03cc1da5917cd3ab0867a9946d3daa6b1f1"
    },
    "mega": {
      "model_id": "flood_risk_assessor_mega",
      "tile_size": 512,
      "base_channels": 64,
      "depth": 5,
      "num_parameters": 60455745,
      "weights_digest": "cf1547c89f2514af3f7d90b612a8cdf3c5276fd20fd579e9bbe96ee25a1d986c"
    }
  }
}
