{
  "$schema": "../manifest.schema.json",
  "family": "forest_density_estimator",
  "name": "Forest Density Estimator",
  "version": "2.0.0",
  "task": "dense_regression",
  "domain": "forestry",
  "architecture": "unet_regression",
  "license": "MPL-2.0",
  "status": "starter",
  "trained": false,
  "description": "Estimates tree canopy cover.",
  "inputs": {
    "bands": [
      "B02",
      "B03",
      "B04",
      "B05",
      "B06",
      "B07",
      "B08",
      "B8A",
      "B11",
      "B12"
    ],
    "dates": 1,
    "channels": [
      "B02",
      "B03",
      "B04",
      "B05",
      "B06",
      "B07",
      "B08",
      "B8A",
      "B11",
      "B12"
    ]
  },
  "outputs": {
    "names": [
      "canopy_cover"
    ],
    "units": [
      "1"
    ],
    "range": [
      0.0,
      1.0
    ],
    "scale": 1,
    "formula": null,
    "layout": "Tensor (N, K, H, W) of target values in the listed units."
  },
  "training_labels": "Canopy cover fraction from LiDAR or high resolution imagery.",
  "data_sources": [
    "Sentinel-2 L2A"
  ],
  "variants": {
    "tiny": {
      "model_id": "forest_density_estimator_tiny",
      "tile_size": 256,
      "base_channels": 16,
      "depth": 3,
      "num_parameters": 733937,
      "weights_digest": "5d88e2cd5d37b224d988921ede0cb03462a092c7d4023ea4a0ed213c4b20a183"
    },
    "base": {
      "model_id": "forest_density_estimator_base",
      "tile_size": 256,
      "base_channels": 32,
      "depth": 4,
      "num_parameters": 7060449,
      "weights_digest": "ea62e26be18ddf91e3e3cc9a55fcab81272a95a77960b3ffff67e31aa4b52bbe"
    },
    "large": {
      "model_id": "forest_density_estimator_large",
      "tile_size": 512,
      "base_channels": 48,
      "depth": 4,
      "num_parameters": 22062097,
      "weights_digest": "15675843616452950696edbcdae31bedb14e2be49ee0591f48f616556ae6d898"
    },
    "mega": {
      "model_id": "forest_density_estimator_mega",
      "tile_size": 512,
      "base_channels": 64,
      "depth": 5,
      "num_parameters": 60454593,
      "weights_digest": "e6b4ce48bb0c332292bb2f440a8301bab2570b993df8d1df5ffbda733145c866"
    }
  }
}
