{
  "$schema": "../manifest.schema.json",
  "family": "object_detector",
  "name": "Generic Object Detector",
  "version": "2.0.0",
  "task": "detection",
  "domain": "ai",
  "architecture": "centernet",
  "license": "MPL-2.0",
  "status": "starter",
  "trained": false,
  "description": "Multi-class detector for common objects in overhead imagery.",
  "inputs": {
    "bands": [
      "red",
      "green",
      "blue"
    ],
    "dates": 1,
    "channels": [
      "red",
      "green",
      "blue"
    ]
  },
  "outputs": {
    "names": [
      "building",
      "vehicle",
      "ship",
      "aircraft",
      "storage_tank",
      "bridge"
    ],
    "units": [],
    "range": null,
    "scale": 1,
    "formula": null,
    "layout": "Tensor (N, K + 4, H/4, W/4): K class heatmap logits, box width and height in output-stride pixels, and the x and y centre offsets."
  },
  "training_labels": "Bounding boxes of the six object classes.",
  "data_sources": [
    "Very high resolution satellite or aerial RGB imagery"
  ],
  "variants": {
    "tiny": {
      "model_id": "object_detector_tiny",
      "tile_size": 256,
      "base_channels": 16,
      "depth": 3,
      "num_parameters": 730746,
      "weights_digest": "0908c3d9e8120f9961209c7dc0b6058ca8a4d8d515cea3f64fcb2b3c55a54183"
    },
    "base": {
      "model_id": "object_detector_base",
      "tile_size": 256,
      "base_channels": 32,
      "depth": 4,
      "num_parameters": 7049450,
      "weights_digest": "72b8f4f99e9a5e4e718c620935104687fcf9ed18783cc417c3aa69af12b3aca7"
    },
    "large": {
      "model_id": "object_detector_large",
      "tile_size": 512,
      "base_channels": 48,
      "depth": 4,
      "num_parameters": 22038682,
      "weights_digest": "c196b30570fa3ce23db14cc8ee5a52338217ee6bbef31b1baa7e4c89ad8371e4"
    },
    "mega": {
      "model_id": "object_detector_mega",
      "tile_size": 512,
      "base_channels": 64,
      "depth": 5,
      "num_parameters": 60414154,
      "weights_digest": "bf03ed34396bf550157af098c9a5328a80e9ff8b373c6200d72c2db6a545af56"
    }
  }
}
