{
  "$schema": "../manifest.schema.json",
  "family": "accessibility_analyzer",
  "name": "Accessibility Analyser",
  "version": "2.0.0",
  "task": "dense_regression",
  "domain": "tourism",
  "architecture": "unet_regression",
  "license": "MPL-2.0",
  "status": "starter",
  "trained": false,
  "description": "Estimates travel time to the nearest service centre per pixel.",
  "inputs": {
    "bands": [
      "B02",
      "B03",
      "B04",
      "B08",
      "B11",
      "B12",
      "elevation",
      "slope",
      "population",
      "road_distance"
    ],
    "dates": 1,
    "channels": [
      "B02",
      "B03",
      "B04",
      "B08",
      "B11",
      "B12",
      "elevation",
      "slope",
      "population",
      "road_distance"
    ]
  },
  "outputs": {
    "names": [
      "travel_time"
    ],
    "units": [
      "min"
    ],
    "range": null,
    "scale": 1,
    "formula": null,
    "layout": "Tensor (N, K, H, W) of target values in the listed units."
  },
  "training_labels": "Travel time rasters from network analysis or surveys.",
  "data_sources": [
    "Sentinel-2 L2A",
    "Copernicus DEM",
    "population and road distance rasters"
  ],
  "variants": {
    "tiny": {
      "model_id": "accessibility_analyzer_tiny",
      "tile_size": 256,
      "base_channels": 16,
      "depth": 3,
      "num_parameters": 733937,
      "weights_digest": "c3a240236b640ac6a29c37a4c92eaf9945b0ec841444c7b8c768b6a33633d1d0"
    },
    "base": {
      "model_id": "accessibility_analyzer_base",
      "tile_size": 256,
      "base_channels": 32,
      "depth": 4,
      "num_parameters": 7060449,
      "weights_digest": "99b03184e6d90860f23b0f843f8e34e1013c74f9842182d857bcab2b66df31f8"
    },
    "large": {
      "model_id": "accessibility_analyzer_large",
      "tile_size": 512,
      "base_channels": 48,
      "depth": 4,
      "num_parameters": 22062097,
      "weights_digest": "236ae4f14afdfd19414a5301f75d9374df901196768f683ff38decfe58aff15e"
    },
    "mega": {
      "model_id": "accessibility_analyzer_mega",
      "tile_size": 512,
      "base_channels": 64,
      "depth": 5,
      "num_parameters": 60454593,
      "weights_digest": "e77bab709795c6230a5a7dc6575eeaec5622086aefa0e74c099db416336d821b"
    }
  }
}
