{
  "$schema": "../manifest.schema.json",
  "family": "route_planner",
  "name": "Route Cost Surface",
  "version": "2.0.0",
  "task": "dense_regression",
  "domain": "tourism",
  "architecture": "unet_regression",
  "license": "MPL-2.0",
  "status": "starter",
  "trained": false,
  "description": "Estimates a travel cost surface for least-cost routing.",
  "inputs": {
    "bands": [
      "B02",
      "B03",
      "B04",
      "B08",
      "B11",
      "B12",
      "elevation",
      "slope",
      "population",
      "road_distance"
    ],
    "dates": 1,
    "channels": [
      "B02",
      "B03",
      "B04",
      "B08",
      "B11",
      "B12",
      "elevation",
      "slope",
      "population",
      "road_distance"
    ]
  },
  "outputs": {
    "names": [
      "travel_cost"
    ],
    "units": [
      "s m-1"
    ],
    "range": null,
    "scale": 1,
    "formula": null,
    "layout": "Tensor (N, K, H, W) of target values in the listed units."
  },
  "training_labels": "Travel cost rasters from speed models.",
  "data_sources": [
    "Sentinel-2 L2A",
    "Copernicus DEM",
    "road distance rasters"
  ],
  "variants": {
    "tiny": {
      "model_id": "route_planner_tiny",
      "tile_size": 256,
      "base_channels": 16,
      "depth": 3,
      "num_parameters": 733937,
      "weights_digest": "4965bcbf980b5c740c346b349923f4b23bd26f36a3ba69e2cf99f5c590a8e3da"
    },
    "base": {
      "model_id": "route_planner_base",
      "tile_size": 256,
      "base_channels": 32,
      "depth": 4,
      "num_parameters": 7060449,
      "weights_digest": "ea38aec6437c110fe94d20d35e3838295240e51b1c9e6d9b4f423a954e96259d"
    },
    "large": {
      "model_id": "route_planner_large",
      "tile_size": 512,
      "base_channels": 48,
      "depth": 4,
      "num_parameters": 22062097,
      "weights_digest": "27e2cb7d2f03a34ecb34b0ff3cc2f8f0133179de019fdee3eea6d6e46825b9e3"
    },
    "mega": {
      "model_id": "route_planner_mega",
      "tile_size": 512,
      "base_channels": 64,
      "depth": 5,
      "num_parameters": 60454593,
      "weights_digest": "8d3388c4ea666e5d743a9fa8b20563770cd56733ec4a26147d61af9cbf654d9f"
    }
  }
}
