{
  "$schema": "../manifest.schema.json",
  "family": "thematic_mapper",
  "name": "Thematic Mapper",
  "version": "2.0.0",
  "task": "segmentation",
  "domain": "imaging",
  "architecture": "unet",
  "license": "MPL-2.0",
  "status": "starter",
  "trained": false,
  "description": "Eight-class thematic mapping for general land cover mapping projects.",
  "inputs": {
    "bands": [
      "B02",
      "B03",
      "B04",
      "B05",
      "B06",
      "B07",
      "B08",
      "B8A",
      "B11",
      "B12"
    ],
    "dates": 1,
    "channels": [
      "B02",
      "B03",
      "B04",
      "B05",
      "B06",
      "B07",
      "B08",
      "B8A",
      "B11",
      "B12"
    ]
  },
  "outputs": {
    "names": [
      "artificial",
      "agricultural",
      "forest",
      "grassland",
      "wetland",
      "water",
      "bare",
      "snow_ice"
    ],
    "units": [],
    "range": null,
    "scale": 1,
    "formula": null,
    "layout": "Tensor (N, K, H, W) of class logits; apply softmax over K."
  },
  "training_labels": "Thematic masks.",
  "data_sources": [
    "Sentinel-2 L2A"
  ],
  "variants": {
    "tiny": {
      "model_id": "thematic_mapper_tiny",
      "tile_size": 256,
      "base_channels": 16,
      "depth": 3,
      "num_parameters": 734056,
      "weights_digest": "f9196c950cc627da321a2a283cd5f8d39f2dcb252dcdae2cfcd4429e7d43a996"
    },
    "base": {
      "model_id": "thematic_mapper_base",
      "tile_size": 256,
      "base_channels": 32,
      "depth": 4,
      "num_parameters": 7060680,
      "weights_digest": "ebf52dc3a51492c339ba99f7502013363c3da738af0e53e9a7cccbd007103225"
    },
    "large": {
      "model_id": "thematic_mapper_large",
      "tile_size": 512,
      "base_channels": 48,
      "depth": 4,
      "num_parameters": 22062440,
      "weights_digest": "713b4d1d277799d30892dbd92eff23984c3aa9c722bc10f9ebe5bbb0f7d54e2c"
    },
    "mega": {
      "model_id": "thematic_mapper_mega",
      "tile_size": 512,
      "base_channels": 64,
      "depth": 5,
      "num_parameters": 60455048,
      "weights_digest": "638d4ffd4b0f4dc73b67de5178c7f59a1fb9ac5ea8cba6b768f156aefcaf2eca"
    }
  }
}
