{
  "$schema": "../manifest.schema.json",
  "family": "insurance_underwriting",
  "name": "Insurance Risk Scorer",
  "version": "2.0.0",
  "task": "scene_regression",
  "domain": "risk",
  "architecture": "encoder_regressor",
  "license": "MPL-2.0",
  "status": "starter",
  "trained": false,
  "description": "Scores the natural hazard risk of an insured site.",
  "inputs": {
    "bands": [
      "B02",
      "B03",
      "B04",
      "B08",
      "B11",
      "B12",
      "elevation",
      "slope",
      "population",
      "road_distance"
    ],
    "dates": 1,
    "channels": [
      "B02",
      "B03",
      "B04",
      "B08",
      "B11",
      "B12",
      "elevation",
      "slope",
      "population",
      "road_distance"
    ]
  },
  "outputs": {
    "names": [
      "hazard_score",
      "exposure_score"
    ],
    "units": [
      "1",
      "1"
    ],
    "range": [
      0.0,
      1.0
    ],
    "scale": 1,
    "formula": null,
    "layout": "Tensor (N, K) with one value per target and chip."
  },
  "training_labels": "Claims history or risk model scores per site.",
  "data_sources": [
    "Sentinel-2 L2A",
    "Copernicus DEM",
    "population and road distance rasters"
  ],
  "variants": {
    "tiny": {
      "model_id": "insurance_underwriting_tiny",
      "tile_size": 256,
      "base_channels": 16,
      "depth": 3,
      "num_parameters": 495522,
      "weights_digest": "6aef3a494b566a4344f5ccaefec8e0da39b28604bc15f9a62a65983adde324fe"
    },
    "base": {
      "model_id": "insurance_underwriting_base",
      "tile_size": 256,
      "base_channels": 32,
      "depth": 4,
      "num_parameters": 3747138,
      "weights_digest": "9e1b2fe0139603d3310645945965b8eff4349ae7aacf2fab05b04c5b904c3a62"
    },
    "large": {
      "model_id": "insurance_underwriting_large",
      "tile_size": 512,
      "base_channels": 48,
      "depth": 4,
      "num_parameters": 14609186,
      "weights_digest": "6c371454fbe0b8ed50f928db20d8e2393c0dc809c9b777cbbe53d74f2d23ec9e"
    },
    "mega": {
      "model_id": "insurance_underwriting_mega",
      "tile_size": 512,
      "base_channels": 64,
      "depth": 5,
      "num_parameters": 37766530,
      "weights_digest": "4cb28f4705828e8a5dc70082693d34fff9240d001537ceebbc46b2881727fe29"
    }
  }
}
