{
  "$schema": "../manifest.schema.json",
  "family": "environmental_monitor",
  "name": "Environmental Condition Monitor",
  "version": "2.0.0",
  "task": "dense_regression",
  "domain": "environment",
  "architecture": "unet_regression",
  "license": "MPL-2.0",
  "status": "starter",
  "trained": false,
  "description": "Scores the ecological condition of land.",
  "inputs": {
    "bands": [
      "B02",
      "B03",
      "B04",
      "B05",
      "B06",
      "B07",
      "B08",
      "B8A",
      "B11",
      "B12"
    ],
    "dates": 1,
    "channels": [
      "B02",
      "B03",
      "B04",
      "B05",
      "B06",
      "B07",
      "B08",
      "B8A",
      "B11",
      "B12"
    ]
  },
  "outputs": {
    "names": [
      "condition"
    ],
    "units": [
      "1"
    ],
    "range": [
      0.0,
      1.0
    ],
    "scale": 1,
    "formula": null,
    "layout": "Tensor (N, K, H, W) of target values in the listed units."
  },
  "training_labels": "Ecological condition scores from field assessment.",
  "data_sources": [
    "Sentinel-2 L2A"
  ],
  "variants": {
    "tiny": {
      "model_id": "environmental_monitor_tiny",
      "tile_size": 256,
      "base_channels": 16,
      "depth": 3,
      "num_parameters": 733937,
      "weights_digest": "bd98b1490381eedd04b381dd595d0da8a9c78992d260ff3f750473651e4ecbd7"
    },
    "base": {
      "model_id": "environmental_monitor_base",
      "tile_size": 256,
      "base_channels": 32,
      "depth": 4,
      "num_parameters": 7060449,
      "weights_digest": "7cc7520b2437bc500d4e491ad731d6841c8b3f4854d59b7bac07dfe12f5c5934"
    },
    "large": {
      "model_id": "environmental_monitor_large",
      "tile_size": 512,
      "base_channels": 48,
      "depth": 4,
      "num_parameters": 22062097,
      "weights_digest": "dfceb0a314259fe624e55617e7789447c5324cde9d638117c98e6e99454bff5f"
    },
    "mega": {
      "model_id": "environmental_monitor_mega",
      "tile_size": 512,
      "base_channels": 64,
      "depth": 5,
      "num_parameters": 60454593,
      "weights_digest": "930370f9e7defb32a91b51a1156711c6022a087d859e2f7deaa2864ee620bf32"
    }
  }
}
