{
  "$schema": "../manifest.schema.json",
  "family": "onshore_monitor",
  "name": "Surface Temperature Anomaly",
  "version": "2.0.0",
  "task": "dense_regression",
  "domain": "energy",
  "architecture": "unet_regression",
  "license": "MPL-2.0",
  "status": "starter",
  "trained": false,
  "description": "Estimates land surface temperature anomalies around onshore industrial facilities.",
  "inputs": {
    "bands": [
      "SR_B2",
      "SR_B3",
      "SR_B4",
      "SR_B5",
      "SR_B6",
      "SR_B7",
      "ST_B10"
    ],
    "dates": 1,
    "channels": [
      "SR_B2",
      "SR_B3",
      "SR_B4",
      "SR_B5",
      "SR_B6",
      "SR_B7",
      "ST_B10"
    ]
  },
  "outputs": {
    "names": [
      "temperature_anomaly"
    ],
    "units": [
      "K"
    ],
    "range": null,
    "scale": 1,
    "formula": null,
    "layout": "Tensor (N, K, H, W) of target values in the listed units."
  },
  "training_labels": "Surface temperature anomaly rasters.",
  "data_sources": [
    "Landsat 8/9 Collection 2 Level 2"
  ],
  "variants": {
    "tiny": {
      "model_id": "onshore_monitor_tiny",
      "tile_size": 256,
      "base_channels": 16,
      "depth": 3,
      "num_parameters": 733505,
      "weights_digest": "17b2cf445cc758ecdc173da673dd4d070a1be1dd81b45e6a2857aa1dee269b92"
    },
    "base": {
      "model_id": "onshore_monitor_base",
      "tile_size": 256,
      "base_channels": 32,
      "depth": 4,
      "num_parameters": 7059585,
      "weights_digest": "d43f55b617fcedd357b641090779aaa9f1836cd65733fe6ca3ca7ccfad2f96b9"
    },
    "large": {
      "model_id": "onshore_monitor_large",
      "tile_size": 512,
      "base_channels": 48,
      "depth": 4,
      "num_parameters": 22060801,
      "weights_digest": "ef78cf86f6db730d4ad00ff7d14de4bc4a091d1347a18d308072ea9d04063f93"
    },
    "mega": {
      "model_id": "onshore_monitor_mega",
      "tile_size": 512,
      "base_channels": 64,
      "depth": 5,
      "num_parameters": 60452865,
      "weights_digest": "67f3ff455ba4b446978d2ef3d0b138e3409f95cf6bf1fa20f78a626e8e6c1f36"
    }
  }
}
