{
  "$schema": "../manifest.schema.json",
  "family": "livestock_estimator",
  "name": "Livestock Estimator",
  "version": "2.0.0",
  "task": "scene_regression",
  "domain": "agriculture",
  "architecture": "encoder_regressor",
  "license": "MPL-2.0",
  "status": "starter",
  "trained": false,
  "description": "Estimates the number of livestock in a chip.",
  "inputs": {
    "bands": [
      "red",
      "green",
      "blue"
    ],
    "dates": 1,
    "channels": [
      "red",
      "green",
      "blue"
    ]
  },
  "outputs": {
    "names": [
      "head_count"
    ],
    "units": [
      "animals"
    ],
    "range": null,
    "scale": 1,
    "formula": null,
    "layout": "Tensor (N, K) with one value per target and chip."
  },
  "training_labels": "Livestock counts per chip.",
  "data_sources": [
    "Very high resolution RGB imagery"
  ],
  "variants": {
    "tiny": {
      "model_id": "livestock_estimator_tiny",
      "tile_size": 256,
      "base_channels": 16,
      "depth": 3,
      "num_parameters": 494481,
      "weights_digest": "65dfec3048c347eee3fb52a38ab93806eece1f7bc12a81fb19e5da7f684eb27c"
    },
    "base": {
      "model_id": "livestock_estimator_base",
      "tile_size": 256,
      "base_channels": 32,
      "depth": 4,
      "num_parameters": 3745057,
      "weights_digest": "1fb5ced7b33c9858f986a7b93053d63f0a22545571fb828806b86f89a1fbb60f"
    },
    "large": {
      "model_id": "livestock_estimator_large",
      "tile_size": 512,
      "base_channels": 48,
      "depth": 4,
      "num_parameters": 14606065,
      "weights_digest": "f6a07af02917c873dda714bc572c11ddb2a3aceadfdeb67cff227df787418d3a"
    },
    "mega": {
      "model_id": "livestock_estimator_mega",
      "tile_size": 512,
      "base_channels": 64,
      "depth": 5,
      "num_parameters": 37762369,
      "weights_digest": "dc61bb8cc359a352d98c6883e9a2dd6c5af773a9157c44aab2d4604f40785621"
    }
  }
}
