{
  "$schema": "../manifest.schema.json",
  "family": "security_monitor",
  "name": "Security Monitor",
  "version": "2.0.0",
  "task": "detection",
  "domain": "defense",
  "architecture": "centernet",
  "license": "MPL-2.0",
  "status": "starter",
  "trained": false,
  "description": "Detects vehicles, vessels and temporary structures around critical sites.",
  "inputs": {
    "bands": [
      "red",
      "green",
      "blue"
    ],
    "dates": 1,
    "channels": [
      "red",
      "green",
      "blue"
    ]
  },
  "outputs": {
    "names": [
      "vehicle",
      "vessel",
      "temporary_structure"
    ],
    "units": [],
    "range": null,
    "scale": 1,
    "formula": null,
    "layout": "Tensor (N, K + 4, H/4, W/4): K class heatmap logits, box width and height in output-stride pixels, and the x and y centre offsets."
  },
  "training_labels": "Bounding boxes of the three object classes.",
  "data_sources": [
    "Very high resolution satellite or aerial RGB imagery"
  ],
  "variants": {
    "tiny": {
      "model_id": "security_monitor_tiny",
      "tile_size": 256,
      "base_channels": 16,
      "depth": 3,
      "num_parameters": 730647,
      "weights_digest": "459bc17bb672c6a53d5cfdd9cb23a4de43023070c4d76bde36bd591bf8a91036"
    },
    "base": {
      "model_id": "security_monitor_base",
      "tile_size": 256,
      "base_channels": 32,
      "depth": 4,
      "num_parameters": 7049255,
      "weights_digest": "21594348dcc33eb7ee8160ad7698f5af7789087996eb4bb9ed3a4519c7993eed"
    },
    "large": {
      "model_id": "security_monitor_large",
      "tile_size": 512,
      "base_channels": 48,
      "depth": 4,
      "num_parameters": 22038391,
      "weights_digest": "f122c21d13eeaa857e6166afb2d74f71bd563870165b94e93ef89dc3cf41e66a"
    },
    "mega": {
      "model_id": "security_monitor_mega",
      "tile_size": 512,
      "base_channels": 64,
      "depth": 5,
      "num_parameters": 60413767,
      "weights_digest": "600261af77a1cf520852f59bf3e619c56b8b1fc36bb7c48e3876309cdb9a1904"
    }
  }
}
