{
  "$schema": "../manifest.schema.json",
  "family": "leakage_detector",
  "name": "Leakage Detector",
  "version": "2.0.0",
  "task": "detection",
  "domain": "assets",
  "architecture": "centernet",
  "license": "MPL-2.0",
  "status": "starter",
  "trained": false,
  "description": "Detects vegetation stress and surface anomalies that indicate pipeline or canal leakage.",
  "inputs": {
    "bands": [
      "blue",
      "green",
      "red",
      "nir",
      "swir1"
    ],
    "dates": 1,
    "channels": [
      "blue",
      "green",
      "red",
      "nir",
      "swir1"
    ]
  },
  "outputs": {
    "names": [
      "leak_signature"
    ],
    "units": [],
    "range": null,
    "scale": 1,
    "formula": null,
    "layout": "Tensor (N, K + 4, H/4, W/4): K class heatmap logits, box width and height in output-stride pixels, and the x and y centre offsets."
  },
  "training_labels": "Bounding boxes of confirmed leak locations.",
  "data_sources": [
    "Multispectral satellite or aerial imagery with a short-wave infrared band"
  ],
  "variants": {
    "tiny": {
      "model_id": "leakage_detector_tiny",
      "tile_size": 256,
      "base_channels": 16,
      "depth": 3,
      "num_parameters": 730869,
      "weights_digest": "25bec0a1be5a702c02d4a0214a97af0b64d730be23a403bb4d63a248d9f23023"
    },
    "base": {
      "model_id": "leakage_detector_base",
      "tile_size": 256,
      "base_channels": 32,
      "depth": 4,
      "num_parameters": 7049701,
      "weights_digest": "4fa44cc09a8248f13035b2ce2342ec1e94cd64943d9a767bbcfb336ab0705b69"
    },
    "large": {
      "model_id": "leakage_detector_large",
      "tile_size": 512,
      "base_channels": 48,
      "depth": 4,
      "num_parameters": 22039061,
      "weights_digest": "681e0badf37ab9e127edd95bc9a321486a45553dc4ad7375b99d0d82e587aa0a"
    },
    "mega": {
      "model_id": "leakage_detector_mega",
      "tile_size": 512,
      "base_channels": 64,
      "depth": 5,
      "num_parameters": 60414661,
      "weights_digest": "a32785ced2048631972c38c1b345ae2a03cf9f1b9f42040aa5913badef384778"
    }
  }
}
