{
  "$schema": "../manifest.schema.json",
  "family": "disaster_management",
  "name": "Disaster Impact Estimator",
  "version": "2.0.0",
  "task": "scene_regression",
  "domain": "risk",
  "architecture": "encoder_regressor",
  "license": "MPL-2.0",
  "status": "starter",
  "trained": false,
  "description": "Estimates the fraction of an area affected by a disaster.",
  "inputs": {
    "bands": [
      "B02",
      "B03",
      "B04",
      "B05",
      "B06",
      "B07",
      "B08",
      "B8A",
      "B11",
      "B12"
    ],
    "dates": 1,
    "channels": [
      "B02",
      "B03",
      "B04",
      "B05",
      "B06",
      "B07",
      "B08",
      "B8A",
      "B11",
      "B12"
    ]
  },
  "outputs": {
    "names": [
      "affected_fraction"
    ],
    "units": [
      "1"
    ],
    "range": [
      0.0,
      1.0
    ],
    "scale": 1,
    "formula": null,
    "layout": "Tensor (N, K) with one value per target and chip."
  },
  "training_labels": "Affected area fractions from damage assessments.",
  "data_sources": [
    "Sentinel-2 L2A"
  ],
  "variants": {
    "tiny": {
      "model_id": "disaster_management_tiny",
      "tile_size": 256,
      "base_channels": 16,
      "depth": 3,
      "num_parameters": 495489,
      "weights_digest": "b3f38a14f38f502a5b4ad73a9b2242df2937403b7e8071e2b6d75002617f6f32"
    },
    "base": {
      "model_id": "disaster_management_base",
      "tile_size": 256,
      "base_channels": 32,
      "depth": 4,
      "num_parameters": 3747073,
      "weights_digest": "06b7bdc48cb4713d5cab6b0a202cd31078bb6cd3e74ed792922f8253fbf31a79"
    },
    "large": {
      "model_id": "disaster_management_large",
      "tile_size": 512,
      "base_channels": 48,
      "depth": 4,
      "num_parameters": 14609089,
      "weights_digest": "640b137d2c0617054c5277e515cafe36a854a916419246684327653739392299"
    },
    "mega": {
      "model_id": "disaster_management_mega",
      "tile_size": 512,
      "base_channels": 64,
      "depth": 5,
      "num_parameters": 37766401,
      "weights_digest": "ac8395efc2a2397f0c58851fd314110330fdcf8e60aff8fb65fc38fb23b6a2ac"
    }
  }
}
