{
  "$schema": "../manifest.schema.json",
  "family": "economic_spatial_assessor",
  "name": "Property Value Estimator",
  "version": "2.0.0",
  "task": "scene_regression",
  "domain": "analysis",
  "architecture": "encoder_regressor",
  "license": "MPL-2.0",
  "status": "starter",
  "trained": false,
  "description": "Estimates median property value of an area.",
  "inputs": {
    "bands": [
      "red",
      "green",
      "blue"
    ],
    "dates": 1,
    "channels": [
      "red",
      "green",
      "blue"
    ]
  },
  "outputs": {
    "names": [
      "median_value"
    ],
    "units": [
      "currency m-2"
    ],
    "range": null,
    "scale": 1,
    "formula": null,
    "layout": "Tensor (N, K) with one value per target and chip."
  },
  "training_labels": "Property transaction statistics aggregated to chips.",
  "data_sources": [
    "Aerial or satellite RGB imagery"
  ],
  "variants": {
    "tiny": {
      "model_id": "economic_spatial_assessor_tiny",
      "tile_size": 256,
      "base_channels": 16,
      "depth": 3,
      "num_parameters": 494481,
      "weights_digest": "2ff065cce8c5be3ebc4e46041b40b61caad22901bb5a3db1188bb69038b83281"
    },
    "base": {
      "model_id": "economic_spatial_assessor_base",
      "tile_size": 256,
      "base_channels": 32,
      "depth": 4,
      "num_parameters": 3745057,
      "weights_digest": "6e8167e448e263235d2ef9e8835d0096efd5deba8a407519a4999bbfd6deb988"
    },
    "large": {
      "model_id": "economic_spatial_assessor_large",
      "tile_size": 512,
      "base_channels": 48,
      "depth": 4,
      "num_parameters": 14606065,
      "weights_digest": "70912f0e6f7064f69fb6b7ad42acb8e108fa9149cad4f9a23d4293cee939caa1"
    },
    "mega": {
      "model_id": "economic_spatial_assessor_mega",
      "tile_size": 512,
      "base_channels": 64,
      "depth": 5,
      "num_parameters": 37762369,
      "weights_digest": "f9795d6d0a1d4084e103f159c7594805821e303c8947fcb5652ea22e400bc0cf"
    }
  }
}
