{
  "$schema": "../manifest.schema.json",
  "family": "sar_flood_detector",
  "name": "SAR Flood Detector",
  "version": "2.0.0",
  "task": "segmentation",
  "domain": "sar",
  "architecture": "unet",
  "license": "MPL-2.0",
  "status": "starter",
  "trained": false,
  "description": "Maps flooded areas in radar backscatter.",
  "inputs": {
    "bands": [
      "VV",
      "VH"
    ],
    "dates": 1,
    "channels": [
      "VV",
      "VH"
    ]
  },
  "outputs": {
    "names": [
      "non_flooded",
      "flooded"
    ],
    "units": [],
    "range": null,
    "scale": 1,
    "formula": null,
    "layout": "Tensor (N, K, H, W) of class logits; apply softmax over K."
  },
  "training_labels": "Flood masks.",
  "data_sources": [
    "Sentinel-1 GRD (sigma0 in dB)"
  ],
  "variants": {
    "tiny": {
      "model_id": "sar_flood_detector_tiny",
      "tile_size": 256,
      "base_channels": 16,
      "depth": 3,
      "num_parameters": 732802,
      "weights_digest": "8cb4bef626f8e2b6aa68cc3a139d280d02c7a2d3fe8f613e77849bc6b7f19424"
    },
    "base": {
      "model_id": "sar_flood_detector_base",
      "tile_size": 256,
      "base_channels": 32,
      "depth": 4,
      "num_parameters": 7058178,
      "weights_digest": "cd201256c738235d128413ead30f9b6d231536ece2e36e0b713fd1248dd3bed9"
    },
    "large": {
      "model_id": "sar_flood_detector_large",
      "tile_size": 512,
      "base_channels": 48,
      "depth": 4,
      "num_parameters": 22058690,
      "weights_digest": "a56c5ae23375e40cacfbda4ec7d389bd1e3493608e3104ed6948128868c0bade"
    },
    "mega": {
      "model_id": "sar_flood_detector_mega",
      "tile_size": 512,
      "base_channels": 64,
      "depth": 5,
      "num_parameters": 60450050,
      "weights_digest": "1038f575654e3f4945af9f9e876246bac9e417ca79b48119e2f013aa6043a084"
    }
  }
}
