{
  "$schema": "../manifest.schema.json",
  "family": "energy_potential",
  "name": "Energy Potential",
  "version": "2.0.0",
  "task": "dense_regression",
  "domain": "energy",
  "architecture": "unet_regression",
  "license": "MPL-2.0",
  "status": "starter",
  "trained": false,
  "description": "Estimates annual solar energy potential per pixel.",
  "inputs": {
    "bands": [
      "B02",
      "B03",
      "B04",
      "B05",
      "B06",
      "B07",
      "B08",
      "B8A",
      "B11",
      "B12",
      "elevation",
      "slope"
    ],
    "dates": 1,
    "channels": [
      "B02",
      "B03",
      "B04",
      "B05",
      "B06",
      "B07",
      "B08",
      "B8A",
      "B11",
      "B12",
      "elevation",
      "slope"
    ]
  },
  "outputs": {
    "names": [
      "solar_potential"
    ],
    "units": [
      "kWh m-2 a-1"
    ],
    "range": null,
    "scale": 1,
    "formula": null,
    "layout": "Tensor (N, K, H, W) of target values in the listed units."
  },
  "training_labels": "Solar potential rasters from irradiance models.",
  "data_sources": [
    "Sentinel-2 L2A",
    "Copernicus DEM"
  ],
  "variants": {
    "tiny": {
      "model_id": "energy_potential_tiny",
      "tile_size": 256,
      "base_channels": 16,
      "depth": 3,
      "num_parameters": 734225,
      "weights_digest": "26b6eb59188a0b75e208074433a4b7ef12d526d5bc72df3739593014fec9ff8d"
    },
    "base": {
      "model_id": "energy_potential_base",
      "tile_size": 256,
      "base_channels": 32,
      "depth": 4,
      "num_parameters": 7061025,
      "weights_digest": "04f0687ccc5ae1496be497fcbee2b13c2f4ed5964879976fe55c0b54fb83a0ae"
    },
    "large": {
      "model_id": "energy_potential_large",
      "tile_size": 512,
      "base_channels": 48,
      "depth": 4,
      "num_parameters": 22062961,
      "weights_digest": "eaf866889a7f18cfd831e2cd0d012587836210d9b6a4a260565637bec6cc8832"
    },
    "mega": {
      "model_id": "energy_potential_mega",
      "tile_size": 512,
      "base_channels": 64,
      "depth": 5,
      "num_parameters": 60455745,
      "weights_digest": "a1092a7b3d5f51b721d116c12da2fce7a0b24cf41bdc2553f8ba4ac9040bffe6"
    }
  }
}
